{"$schema":"https://json-schema.org/draft/2020-12/schema","$id":"https://novel-production-os.local/schemas/soft-challenge-report.v1.schema.json","type":"object","additionalProperties":false,"required":["schema_version","challenge_hash","threshold_bundle_hash","sample_count","matrices","totals","results","template_holdout_claim_separate","report_hash"],"properties":{"schema_version":{"const":"soft-challenge-report.v1"},"challenge_hash":{"$ref":"#/$defs/hash"},"threshold_bundle_hash":{"$ref":"#/$defs/hash"},"sample_count":{"const":36},"matrices":{"type":"array","minItems":3,"maxItems":3,"items":{"type":"object"}},"totals":{"type":"object","additionalProperties":false,"required":["tp","fp","tn","fn"],"properties":{"tp":{"type":"integer"},"fp":{"type":"integer"},"tn":{"type":"integer"},"fn":{"type":"integer"}}},"results":{"type":"array","minItems":36,"maxItems":36,"items":{"type":"object"}},"template_holdout_claim_separate":{"const":true},"report_hash":{"$ref":"#/$defs/hash"}},"$defs":{"hash":{"type":"string","pattern":"^sha256:[0-9a-f]{64}$"}}}