{"challenge_hash":"sha256:6b0176b1d4edd76574fd5e31bd18a8aacb7f92cbabc9f2fc6d134601b4d142ad","matrices":[{"detector_id":"persona_drift","fn":3,"fp":0,"precision":1.0,"recall":0.5,"sample_count":12,"tn":6,"tp":3},{"detector_id":"trope_repeat","fn":3,"fp":0,"precision":1.0,"recall":0.5,"sample_count":12,"tn":6,"tp":3},{"detector_id":"word_count_cheat","fn":3,"fp":0,"precision":1.0,"recall":0.5,"sample_count":12,"tn":6,"tp":3}],"report_hash":"sha256:ee9147a8e272424ea2628fe1b9ac8f7ec1c01795028d488fe4863519e16466d9","results":[{"actual_detected":true,"detector_id":"persona_drift","expected_detected":true,"feature_value":1.0,"outcome":"tp","sample_id":"challenge_persona_drift_01","template_relation":"in_contract","threshold":1.0},{"actual_detected":true,"detector_id":"persona_drift","expected_detected":true,"feature_value":1.0,"outcome":"tp","sample_id":"challenge_persona_drift_02","template_relation":"in_contract","threshold":1.0},{"actual_detected":true,"detector_id":"persona_drift","expected_detected":true,"feature_value":1.0,"outcome":"tp","sample_id":"challenge_persona_drift_03","template_relation":"in_contract","threshold":1.0},{"actual_detected":false,"detector_id":"persona_drift","expected_detected":true,"feature_value":null,"outcome":"fn","sample_id":"challenge_persona_drift_04","template_relation":"out_of_template","threshold":1.0},{"actual_detected":false,"detector_id":"persona_drift","expected_detected":true,"feature_value":null,"outcome":"fn","sample_id":"challenge_persona_drift_05","template_relation":"out_of_template","threshold":1.0},{"actual_detected":false,"detector_id":"persona_drift","expected_detected":true,"feature_value":null,"outcome":"fn","sample_id":"challenge_persona_drift_06","template_relation":"out_of_template","threshold":1.0},{"actual_detected":false,"detector_id":"persona_drift","expected_detected":false,"feature_value":0.0,"outcome":"tn","sample_id":"challenge_persona_drift_07","template_relation":"negative_control","threshold":1.0},{"actual_detected":false,"detector_id":"persona_drift","expected_detected":false,"feature_value":0.0,"outcome":"tn","sample_id":"challenge_persona_drift_08","template_relation":"negative_control","threshold":1.0},{"actual_detected":false,"detector_id":"persona_drift","expected_detected":false,"feature_value":0.0,"outcome":"tn","sample_id":"challenge_persona_drift_09","template_relation":"negative_control","threshold":1.0},{"actual_detected":false,"detector_id":"persona_drift","expected_detected":false,"feature_value":null,"outcome":"tn","sample_id":"challenge_persona_drift_10","template_relation":"negative_control","threshold":1.0},{"actual_detected":false,"detector_id":"persona_drift","expected_detected":false,"feature_value":null,"outcome":"tn","sample_id":"challenge_persona_drift_11","template_relation":"negative_control","threshold":1.0},{"actual_detected":false,"detector_id":"persona_drift","expected_detected":false,"feature_value":null,"outcome":"tn","sample_id":"challenge_persona_drift_12","template_relation":"negative_control","threshold":1.0},{"actual_detected":true,"detector_id":"trope_repeat","expected_detected":true,"feature_value":3.0,"outcome":"tp","sample_id":"challenge_trope_repeat_01","template_relation":"in_contract","threshold":2.0},{"actual_detected":true,"detector_id":"trope_repeat","expected_detected":true,"feature_value":3.0,"outcome":"tp","sample_id":"challenge_trope_repeat_02","template_relation":"in_contract","threshold":2.0},{"actual_detected":true,"detector_id":"trope_repeat","expected_detected":true,"feature_value":3.0,"outcome":"tp","sample_id":"challenge_trope_repeat_03","template_relation":"in_contract","threshold":2.0},{"actual_detected":false,"detector_id":"trope_repeat","expected_detected":true,"feature_value":0.0,"outcome":"fn","sample_id":"challenge_trope_repeat_04","template_relation":"out_of_template","threshold":2.0},{"actual_detected":false,"detector_id":"trope_repeat","expected_detected":true,"feature_value":0.0,"outcome":"fn","sample_id":"challenge_trope_repeat_05","template_relation":"out_of_template","threshold":2.0},{"actual_detected":false,"detector_id":"trope_repeat","expected_detected":true,"feature_value":0.0,"outcome":"fn","sample_id":"challenge_trope_repeat_06","template_relation":"out_of_template","threshold":2.0},{"actual_detected":false,"detector_id":"trope_repeat","expected_detected":false,"feature_value":0.0,"outcome":"tn","sample_id":"challenge_trope_repeat_07","template_relation":"negative_control","threshold":2.0},{"actual_detected":false,"detector_id":"trope_repeat","expected_detected":false,"feature_value":0.0,"outcome":"tn","sample_id":"challenge_trope_repeat_08","template_relation":"negative_control","threshold":2.0},{"actual_detected":false,"detector_id":"trope_repeat","expected_detected":false,"feature_value":0.0,"outcome":"tn","sample_id":"challenge_trope_repeat_09","template_relation":"negative_control","threshold":2.0},{"actual_detected":false,"detector_id":"trope_repeat","expected_detected":false,"feature_value":0.0,"outcome":"tn","sample_id":"challenge_trope_repeat_10","template_relation":"negative_control","threshold":2.0},{"actual_detected":false,"detector_id":"trope_repeat","expected_detected":false,"feature_value":0.0,"outcome":"tn","sample_id":"challenge_trope_repeat_11","template_relation":"negative_control","threshold":2.0},{"actual_detected":false,"detector_id":"trope_repeat","expected_detected":false,"feature_value":0.0,"outcome":"tn","sample_id":"challenge_trope_repeat_12","template_relation":"negative_control","threshold":2.0},{"actual_detected":true,"detector_id":"word_count_cheat","expected_detected":true,"feature_value":0.6122448979591837,"outcome":"tp","sample_id":"challenge_word_count_cheat_01","template_relation":"in_contract","threshold":0.5915492957746479},{"actual_detected":true,"detector_id":"word_count_cheat","expected_detected":true,"feature_value":0.6122448979591837,"outcome":"tp","sample_id":"challenge_word_count_cheat_02","template_relation":"in_contract","threshold":0.5915492957746479},{"actual_detected":true,"detector_id":"word_count_cheat","expected_detected":true,"feature_value":0.6122448979591837,"outcome":"tp","sample_id":"challenge_word_count_cheat_03","template_relation":"in_contract","threshold":0.5915492957746479},{"actual_detected":false,"detector_id":"word_count_cheat","expected_detected":true,"feature_value":0.0,"outcome":"fn","sample_id":"challenge_word_count_cheat_04","template_relation":"out_of_template","threshold":0.5915492957746479},{"actual_detected":false,"detector_id":"word_count_cheat","expected_detected":true,"feature_value":0.0,"outcome":"fn","sample_id":"challenge_word_count_cheat_05","template_relation":"out_of_template","threshold":0.5915492957746479},{"actual_detected":false,"detector_id":"word_count_cheat","expected_detected":true,"feature_value":0.0,"outcome":"fn","sample_id":"challenge_word_count_cheat_06","template_relation":"out_of_template","threshold":0.5915492957746479},{"actual_detected":false,"detector_id":"word_count_cheat","expected_detected":false,"feature_value":0.0,"outcome":"tn","sample_id":"challenge_word_count_cheat_07","template_relation":"negative_control","threshold":0.5915492957746479},{"actual_detected":false,"detector_id":"word_count_cheat","expected_detected":false,"feature_value":0.0,"outcome":"tn","sample_id":"challenge_word_count_cheat_08","template_relation":"negative_control","threshold":0.5915492957746479},{"actual_detected":false,"detector_id":"word_count_cheat","expected_detected":false,"feature_value":0.0,"outcome":"tn","sample_id":"challenge_word_count_cheat_09","template_relation":"negative_control","threshold":0.5915492957746479},{"actual_detected":false,"detector_id":"word_count_cheat","expected_detected":false,"feature_value":0.0,"outcome":"tn","sample_id":"challenge_word_count_cheat_10","template_relation":"negative_control","threshold":0.5915492957746479},{"actual_detected":false,"detector_id":"word_count_cheat","expected_detected":false,"feature_value":0.0,"outcome":"tn","sample_id":"challenge_word_count_cheat_11","template_relation":"negative_control","threshold":0.5915492957746479},{"actual_detected":false,"detector_id":"word_count_cheat","expected_detected":false,"feature_value":0.0,"outcome":"tn","sample_id":"challenge_word_count_cheat_12","template_relation":"negative_control","threshold":0.5915492957746479}],"sample_count":36,"schema_version":"soft-challenge-report.v1","template_holdout_claim_separate":true,"threshold_bundle_hash":"sha256:c7f35608853f6a784df4ddf59e2c7b01449e4f23e2829e67650b55a1aee0963e","totals":{"fn":9,"fp":0,"tn":18,"tp":9}}